"nome_fantasia";"razao_social";"municipio";"id_cnes";"tipo"
USF ALBANO PAES VILA INDEPENDENCIA;PREFEITURA MUNICIPAL DE BARRA MANSA;BARRA MANSA;2279673;CENTRO DE SAUDE/UNIDADE BASICA
UBS VEREADOR PAULO CESAR NOGUEIRA COTIARA;SECRETARIA MUNICIPAL DE SAUDE DE BARRA MANSA;BARRA MANSA;2279711;CENTRO DE SAUDE/UNIDADE BASICA
USF AMELIA LEONARDA P FEITOSA SIDERLANDIA;PREFEITURA MUNICIPAL DE BARRA MANSA;BARRA MANSA;2279738;CENTRO DE SAUDE/UNIDADE BASICA
USF INT VENERAVEL HUMBERTO AMARAL JARDIM PRIMAVERA;PREFEITURA MUNICIPAL DE BARRA MANSA;BARRA MANSA;2279908;CENTRO DE SAUDE/UNIDADE BASICA
USF RIALTO;PREFEITURA MUNICIPAL DE BARRA MANSA;BARRA MANSA;2279940;CENTRO DE SAUDE/UNIDADE BASICA
USF INTEGRADA TANCREDO NEVE PITEIRAS;PREFEITURA MUNICIPAL BARRA MANSA;BARRA MANSA;2279959;CENTRO DE SAUDE/UNIDADE BASICA
USF VILA URSULINO;PREFEITURA MUNICIPAL DE BARRA MANSA;BARRA MANSA;2279991;CENTRO DE SAUDE/UNIDADE BASICA
USF SANTA RITA DE CASSIA;PREFEITURA MUNICIPAL DE BARRA MANSA;BARRA MANSA;2280000;CENTRO DE SAUDE/UNIDADE BASICA
USF BRASILINA N SILVA SAUDADE;SECRETARIA MUNICIPAL DE SAUDE DE BARRA MANSA;BARRA MANSA;2280019;CENTRO DE SAUDE/UNIDADE BASICA
USF VALE DO PARAIBA;SECRETARIA MUNICIPAL DE SAUDE DE BARRA MANSA;BARRA MANSA;2280027;POSTO DE SAUDE
CENTRO DE SAUDE JOSE C DE OLIVEIRA UBS CENTRO;PREFEITURA MUNICIPAL DE BARRA MANSA;BARRA MANSA;2280078;CENTRO DE SAUDE/UNIDADE BASICA
UNIDADE DE EPIDEMIOLOGIA;SECRETARIA MUNICIPAL DE SAUDE DE BARRA MANSA;BARRA MANSA;2280094;UNIDADE DE VIGILANCIA EM SAUDE
SMS POLICLINICA LINCOLN DE FREITAS FILHO AP 53;SMS RIO POLICLINICA LINCOLN DE FREITAS FILHO AP 53;RIO DE JANEIRO;2280191;POLICLINICA
SMS CMS RODOLPHO PERISSE VIDIGAL AP 21;SMS RIO CMS DR RODOLPHO PERISSE AP 21;RIO DE JANEIRO;2280205;CENTRO DE SAUDE/UNIDADE BASICA
SMS MATERNIDADE CARMELA DUTRA AP 32;SMS RIO MATERNIDADE CARMELA DUTRA AP 32;RIO DE JANEIRO;2280248;HOSPITAL ESPECIALIZADO
SMS CMS MARIA AUGUSTA ESTRELLA AP 22;SMS RIO CMS MARIA AUGUSTA ESTRELLA AP 22;RIO DE JANEIRO;2280272;CENTRO DE SAUDE/UNIDADE BASICA
SMS CMS NICOLA ALBANO AP 22;SMS RIO CMS NICOLA ALBANO AP 22;RIO DE JANEIRO;2280280;CENTRO DE SAUDE/UNIDADE BASICA
SMS POLICLINICA ANTONIO RIBEIRO NETTO AP 10;SMS RIO POLICLINICA ANTONIO RIBEIRO NETTO AP 10;RIO DE JANEIRO;2280299;POLICLINICA
SMS CF ERNANI DE PAIVA FERREIRA BRAGA AP 53;SMS RIO CF PROF ERNANI DE PAIVA FERREIRA BRAGA AP 53;RIO DE JANEIRO;2280310;CENTRO DE SAUDE/UNIDADE BASICA
USF ANTONIO ANEZIO MARCHON;SECRETARIA MUNICIPAL DE SAUDE DE CASIMIRO DE ABREU RJ;CASIMIRO DE ABREU;2280329;CENTRO DE SAUDE/UNIDADE BASICA
USF AMARO MOTTA DE OLIVEIRA;SECRETARIA MUNICIPAL DE SAUDE DE CASIMIRO DE ABREU RJ;CASIMIRO DE ABREU;2280361;CENTRO DE SAUDE/UNIDADE BASICA
HOSPITAL MUNICIPAL ANGELA MARIA SIMOES MENEZES;HOSPITAL MUNICIPAL ANGELA MARIA SIMOES MENEZES;CASIMIRO DE ABREU;2280396;HOSPITAL GERAL
UNIDADE DE SAUDE DA FAMILIA PORTO DO CARRO;SECRETARIA MUNICIPAL DE SAUDE DE SAO PEDRO DA ALDEIA;SAO PEDRO DA ALDEIA;2280418;CENTRO DE SAUDE/UNIDADE BASICA
UNIDADE BASICA DE SAUDE FLUMINENSE;SECRETARIA MUNICIPAL DE SAUDE DE SAO PEDRO DA ALDEIA;SAO PEDRO DA ALDEIA;2280515;CENTRO DE SAUDE/UNIDADE BASICA
UNIDADE BASICA DE SAUDE RUA DO FOGO;SECRETARIA MUNICIPAL DE SAUDE DE SAO PEDRO DA ALDEIA;SAO PEDRO DA ALDEIA;2280574;CENTRO DE SAUDE/UNIDADE BASICA
UNIDADE DE SAUDE DA FAMILIA ALECRIM;SECRETARIA MUNICIPAL DE SAUDE DE SAO PEDRO DA ALDEIA;SAO PEDRO DA ALDEIA;2280590;CENTRO DE SAUDE/UNIDADE BASICA
SMS CMS RENATO ROCCO AP 32;SMS RIO CMS DR RENATO ROCCO AP 32;RIO DE JANEIRO;2280736;CENTRO DE SAUDE/UNIDADE BASICA
SMS CMS CARLOS GENTILLE DE MELLO AP 32;SMS RIO CMS DR CARLOS GENTILLE DE MELLO AP 32;RIO DE JANEIRO;2280744;CENTRO DE SAUDE/UNIDADE BASICA
SMS CMS MARIA APARECIDA DE ALMEIDA AP 53;SMS RIO CMS DR MARIA APARECIDA DE ALMEIDA AP53;RIO DE JANEIRO;2280760;CENTRO DE SAUDE/UNIDADE BASICA
SMS CMS NECKER PINTO AP 31;SMS RIO CMS NECKER PINTO AP 31;RIO DE JANEIRO;2280779;CENTRO DE SAUDE/UNIDADE BASICA
SMS CMS NILZA ROSA AP 22;SMS RIO CMS NILZA ROSA AP 22;RIO DE JANEIRO;2280787;CENTRO DE SAUDE/UNIDADE BASICA
SMS CMS JOAO BARROS BARRETO AP 21;SMS RIO CMS JOAO BARROS BARRETO AP 21;RIO DE JANEIRO;2280795;CENTRO DE SAUDE/UNIDADE BASICA
ESTRATEGIA DE SAUDE DA FAMILIA PORTOGALO;SECRETARIA MUNICIPAL DE SAUDE;ANGRA DOS REIS;2280817;CENTRO DE SAUDE/UNIDADE BASICA
HOSPITAL E MATERNIDADE DE ANGRA DOS REIS HMAR;SECRETARIA MUNICIPAL DE SAUDE DE ANGRA DOS REIS;ANGRA DOS REIS;2280868;HOSPITAL GERAL
UNIDADE DE SAUDE DO MORRO DO PERES E GLORIA I;SECRETARIA MUNICIPAL DE SAUDE;ANGRA DOS REIS;2280965;CENTRO DE SAUDE/UNIDADE BASICA
UNIDADE DE SAUDE CAMORIM;SECRETARIA MUNICIPAL DE SAUDE;ANGRA DOS REIS;2281074;CENTRO DE SAUDE/UNIDADE BASICA
UNIDADE DE SAUDE DO BRACUHY;SECRETARIA MUNICIPAL DE SAUDE;ANGRA DOS REIS;2281112;CENTRO DE SAUDE/UNIDADE BASICA
ESTRATEGIA DE SAUDE DA FAMILIA PEREQUE MODULO 3;SECRETARIA MUNICIPAL DE SAUDE;ANGRA DOS REIS;2281430;CENTRO DE SAUDE/UNIDADE BASICA
CENTRO MUNICIPAL DE ESPECIALIDADES ENGENHEIRO PEDREIRA;MUNICIPIO DE JAPERI;JAPERI;2281481;POLICLINICA
MMF JOSE ANTONIO ECHEVERRIA BIANCHI;FUNDACAO ESTATAL DE SAUDE DE NITEROI FESAUDE;NITEROI;2282216;CENTRO DE SAUDE/UNIDADE BASICA
CENTRO DE SAUDE DR JOSE VIEIRA SERODIO;SECRETARIA MUNICIPAL DE SAUDE DE BOM JESUS DO ITABAPOANA;BOM JESUS DO ITABAPOANA;2282569;POLICLINICA
POSTO DE SAUDE DA FAMILIA DE BARRA ALEGRE;FUNDO MUNICIPAL DE SAUDE DE BOM JARDIM;BOM JARDIM;2282844;CENTRO DE SAUDE/UNIDADE BASICA
HOSPITAL MUNICIPAL LUIZ GONZAGA;SECRETARIA MUNICIPAL DE SAUDE DE MIGUEL PEREIRA;MIGUEL PEREIRA;2283239;HOSPITAL GERAL
CENTRO DE SAUDE OSWALDO CRUZ;SECRETARIA MUNICIPAL DE SAUDE DE CABO FRIO;CABO FRIO;2283379;CLINICA/CENTRO DE ESPECIALIDADE
HOSPITAL SAO JOSE OPERARIO;SECRETARIA MUNICIPAL DE SAUDE DE CABO FRIO;CABO FRIO;2283395;HOSPITAL GERAL
UNIDADE DE SAUDE DA FAMILIA PILAR;MUNICIPIO DE DUQUE DE CAXIAS;DUQUE DE CAXIAS;2283484;CENTRO DE SAUDE/UNIDADE BASICA
UNIDADE DE SAUDE DA FAMILIA NELSON CHAVES DE ARAUJO;MUNICIPIO DE DUQUE DE CAXIAS;DUQUE DE CAXIAS;2283549;CENTRO DE SAUDE/UNIDADE BASICA
UNIDADE DE SAUDE DA FAMILIA JARDIM GRAMACHO;MUNICIPIO DE DUQUE DE CAXIAS;DUQUE DE CAXIAS;2283638;CENTRO DE SAUDE/UNIDADE BASICA
UNIDADE DE SAUDE DA FAMILIA VILA CORTES;SECRETARIA MUNICIPAL DE SAUDE DE TANGUA;TANGUA;2283727;CENTRO DE SAUDE/UNIDADE BASICA
UNIDADE DE SAUDE DA FAMILIA TUCAO;SECRETARIA MUNICIPAL DE SAUDE DE SAO JOAO DE MERITI;SAO JOAO DE MERITI;2283999;CENTRO DE SAUDE/UNIDADE BASICA
UNIDADE DE SAUDE DA FAMILIA VILA NORMA;SECRETARIA MUNICIPAL DE SAUDE DE SAO JOAO DE MERITI;SAO JOAO DE MERITI;2284006;CENTRO DE SAUDE/UNIDADE BASICA
UNIDADE DE SAUDE DA FAMILIA PARQUE ARARUAMA;SECRETARIA MUNICIPAL DE SAUDE DE SAO JOAO DE MERITI;SAO JOAO DE MERITI;2284022;CENTRO DE SAUDE/UNIDADE BASICA
UNIDADE DE SAUDE DA FAMILIA VILA ROSALI;SECRETARIA MUNICIPAL DE SAUDE DE SAO JOAO DE MERITI;SAO JOAO DE MERITI;2284030;CENTRO DE SAUDE/UNIDADE BASICA
POSTO MEDICO SANITARIO VILA UNIAO;SECRETARIA MUNICIPAL DE SAUDE DE SAO JOAO DE MERITI;SAO JOAO DE MERITI;2284073;CENTRO DE SAUDE/UNIDADE BASICA
POSTO MEDICO SANITARIO VILA SAO JOAO;SECRETARIA MUNICIPAL DE SAUDE DE SAO JOAO DE MERITI;SAO JOAO DE MERITI;2284081;CENTRO DE SAUDE/UNIDADE BASICA
CLINICA DA FAMILIA DIRCEU DE AQUINO RAMOS;SECRETARIA MUNICIPAL DE SAUDE DE NOVA IGUACU;NOVA IGUACU;2284138;CENTRO DE SAUDE/UNIDADE BASICA
CLINICA DA FAMILIA SANTA RITA;SECRETARIA MUNICIPAL DE SAUDE DE NOVA IGUACU;NOVA IGUACU;2284146;CENTRO DE SAUDE/UNIDADE BASICA
CENTRO DE SAUDE DR VASCO BARCELOS;SECRETARIA MUNICIPAL DE SAUDE DE NOVA IGUACU;NOVA IGUACU;2284170;CLINICA/CENTRO DE ESPECIALIDADE
SUPER CLINICA DA FAMILIA DACYR SOARES;MUNICIPIO DE NOVA IGUACU;NOVA IGUACU;2284197;CENTRO DE SAUDE/UNIDADE BASICA
CLINICA DA FAMILIA ERALDO SARDINHA;MUNICIPIO DE NOVA IGUACU;NOVA IGUACU;2284227;CENTRO DE SAUDE/UNIDADE BASICA
CLINICA DA FAMILIA JARDIM ROMA;SECRETARIA MUNICIPAL DE SAUDE DE NOVA IGUACU;NOVA IGUACU;2284235;CENTRO DE SAUDE/UNIDADE BASICA
CLINICA DA FAMILIA SANTA EUGENIA;SECRETARIA MUNICIPAL DE SAUDE DE NOVA IGUACU;NOVA IGUACU;2284243;CENTRO DE SAUDE/UNIDADE BASICA
CLINICA DA FAMILIA VILA OPERARIA;MUNICIPIO DE NOVA IGUACU;NOVA IGUACU;2284251;CENTRO DE SAUDE/UNIDADE BASICA
POLICLINICA EDI PINTO DA SILVA;SECRETARIA MUNICIPAL DE SAUDE DE NOVA IGUACU;NOVA IGUACU;2284286;POLICLINICA
CLINICA DA FAMILIA HERONDILHO RIBEIRO DA SILVA;SECRETARIA MUNICIPAL DE SAUDE DE NOVA IGUACU;NOVA IGUACU;2284332;CENTRO DE SAUDE/UNIDADE BASICA
CLINICA DA FAMILIA RODILANDIA;SECRETARIA MUNICIPAL DE SAUDE DE NOVA IGUACU;NOVA IGUACU;2284359;CENTRO DE SAUDE/UNIDADE BASICA
CLINICA DA FAMILIA NOVA ERA;SECRETARIA MUNICIPAL DE SAUDE DE NOVA IGUACU;NOVA IGUACU;2284367;CENTRO DE SAUDE/UNIDADE BASICA
CLINICA DA FAMILIA VALVERDE;SECRETARIA MUNICIPAL DE SAUDE DE NOVA IGUACU;NOVA IGUACU;2284383;CENTRO DE SAUDE/UNIDADE BASICA
CLINICA DA FAMILIA JOSE RODRIGUES DA SILVA;SECRETARIA MUNICIPAL DE SAUDE DE NOVA IGUACU;NOVA IGUACU;2284405;CENTRO DE SAUDE/UNIDADE BASICA
CLINICA DA FAMILIA COBREX;SECRETARIA MUNICIPAL DE SAUDE DE NOVA IGUACU;NOVA IGUACU;2284421;CENTRO DE SAUDE/UNIDADE BASICA
CLINICA DA FAMILIA CORUMBA;SECRETARIA MUNICIPAL DE SAUDE DE NOVA IGUACU;NOVA IGUACU;2284502;CENTRO DE SAUDE/UNIDADE BASICA
HOSPITAL MUNICIPAL SAO FRANCISCO XAVIER;MUNICIPIO DE ITAGUAI;ITAGUAI;2284634;HOSPITAL GERAL
UNIDADE SAUDE DA FAMILIA BRISAMAR;UNIDADE SAUDE DA FAMILIA BRISAMAR;ITAGUAI;2284650;CENTRO DE SAUDE/UNIDADE BASICA
UNIDADE SAUDE DA FAMILIA COROA GRANDE;MUNICIPIO DE ITAGUAI;ITAGUAI;2284685;CENTRO DE SAUDE/UNIDADE BASICA
UNIDADE SAUDE DA FAMILIA DR MARCO AURELIO COUTO SILVA;UNIDADE SAUDE DA FAMILIA DR MARCO AURELIO COUTO SILVA;ITAGUAI;2284987;CENTRO DE SAUDE/UNIDADE BASICA
UNIDADE SAUDE DA FAMILIA MANGUEIRA;MUNICIPIO DE ITAGUAI;ITAGUAI;2285061;CENTRO DE SAUDE/UNIDADE BASICA
UNIDADE SAUDE DA FAMILIA ODNIT MAIA;MUNICIPIO DE ITAGUAI;ITAGUAI;2285096;CENTRO DE SAUDE/UNIDADE BASICA
CENTRO PEDIATRICO MUNICIPAL DR ALMIR BRANCO;SECRETARIA MUNICIPAL DE SAUDE DE RIO BONITO;RIO BONITO;2285568;CLINICA/CENTRO DE ESPECIALIDADE
POLICLINICA DR AUGUSTO LEMGRUBER;SECRETARIA MUNICIPAL DE SAUDE DE TRAJANO DE MORAIS;TRAJANO DE MORAES;2285622;POLICLINICA
CLINICA DA FAMILIA BANCO DE AREIA;SECRETARIA MUNICIPAL DE SAUDE DE MESQUITA;MESQUITA;2285991;CENTRO DE SAUDE/UNIDADE BASICA
UNIDADE DE SAUDE DA FAMILIA VILA NORMA;SECRETARIA MUNICIPAL DE SAUDE DE MESQUITA;MESQUITA;2286025;CENTRO DE SAUDE/UNIDADE BASICA
CLINICA DA FAMILIA FRANCA LEITE;SECRETARIA MUNICIPAL DE SAUDE DE MESQUITA;MESQUITA;2286033;CENTRO DE SAUDE/UNIDADE BASICA
CLINICA DA FAMILIA JACUTINGA;SECRETARIA MUNICIPAL DE SAUDE DE MESQUITA;MESQUITA;2286041;CENTRO DE SAUDE/UNIDADE BASICA
CLINICA DA FAMILIA EDSON PASSOS;SECRETARIA MUNICIPAL DE SAUDE DE MESQUITA;MESQUITA;2286068;CENTRO DE SAUDE/UNIDADE BASICA
CLINICA DA FAMILIA JUSCELINO;SECRETARIA MUNICIPAL DE SAUDE DE MESQUITA;MESQUITA;2286076;CENTRO DE SAUDE/UNIDADE BASICA
CLINICA DA FAMILIA BNH;SECRETARIA MUNICIPAL DE SAUDE DE MESQUITA;MESQUITA;2286106;CENTRO DE SAUDE/UNIDADE BASICA
SANTA CASA DE MISERICORDIA DE SAO JOAO DA BARRA;SANTA CASA DE MISERICORDIA DE SAO JOAO DA BARRA;SAO JOAO DA BARRA;2286289;HOSPITAL GERAL
UBS VILA NOVA ARLINDO TAVARES E SILVA;PREFEITURA MUNICIPAL DE IGUABA GRANDE;IGUABA GRANDE;2286300;CENTRO DE SAUDE/UNIDADE BASICA
UNIDADE BASICA DE SAUDE ELDORADO;SECRETARIA MUNICIPAL DE SAUDE DE CAMPOS DOS GOYTACAZES;CAMPOS DOS GOYTACAZES;2286378;CENTRO DE SAUDE/UNIDADE BASICA
CENTRO DE SAUDE GUARUS DR HENRIQUE DE SOUZA OLIVEIRA;SECRETARIA MUNICIPAL DE SAUDE DE CAMPOS DOS GOYTACAZES;CAMPOS DOS GOYTACAZES;2286556;CENTRO DE SAUDE/UNIDADE BASICA
CLUBE DA TERCEIRA IDADE;SECRETARIA MUNICIPAL DE SAUDE DE CAMPOS DOS GOYTACAZES;CAMPOS DOS GOYTACAZES;2286726;POLICLINICA
UNIDADE BASICA DE SAUDE DR JAMIL ABIDO;SECRETARIA MUNICIPAL DE SAUDE DE CAMPOS DOS GOYTACAZES;CAMPOS DOS GOYTACAZES;2286734;CENTRO DE SAUDE/UNIDADE BASICA
UNIDADE BASICA DE SAUDE DA FAMILIA SANTO AMARO;SECRETARIA MUNICIPAL DE SAUDE DE CAMPOS DOS GOYTACAZES;CAMPOS DOS GOYTACAZES;2286793;CENTRO DE SAUDE/UNIDADE BASICA
CENTRO REFERENCIA TRATAMENTO DA CRIANCA E DO ADOLESCENTE;SECRETARIA MUNICIPAL DE SAUDE DE CAMPOS DOS GOYTACAZES;CAMPOS DOS GOYTACAZES;2287013;CENTRO DE SAUDE/UNIDADE BASICA
UNIDADE BASICA DE SAUDE IPS;SECRETARIA MUNICIPAL DE SAUDE DE CAMPOS DOS GOYTACAZES;CAMPOS DOS GOYTACAZES;2287064;CENTRO DE SAUDE/UNIDADE BASICA
UNIDADE BASICA DE SAUDE DA FAMILIA PARQUE PRAZERES;SECRETARIA MUNICIPAL DE SAUDE DE CAMPOS DOS GOYTACAZES;CAMPOS DOS GOYTACAZES;2287145;CENTRO DE SAUDE/UNIDADE BASICA
UNIDADE PRE HOSPITALAR DE URURAI;FUNDACAO MUNICIPAL DE SAUDE;CAMPOS DOS GOYTACAZES;2287161;PRONTO ATENDIMENTO
SOCIEDADE PORTUGUESA DE BENEFICENCIA DE CAMPOS;SOCIEDADE PORTUGUESA DE BENEFICENCIA DE CAMPOS;CAMPOS DOS GOYTACAZES;2287250;HOSPITAL GERAL
VIGILANCIA EPIDEMIOLOGICA;SECRETARIA MUNICIPAL DE SAUDE DE CAMPOS DOS GOYTACAZES;CAMPOS DOS GOYTACAZES;2287471;UNIDADE DE VIGILANCIA EM SAUDE
HOSPITAL FERREIRA MACHADO;FUNDACAO MUNICIPAL DE SAUDE;CAMPOS DOS GOYTACAZES;2287579;HOSPITAL GERAL
ESF VARGEM GRANDE ANTONIO CARDOSO DA SILVEIRA;MUNICIPIO DE BARRA DO PIRAI;BARRA DO PIRAI;2287706;CENTRO DE SAUDE/UNIDADE BASICA
ESF CALIFORNIA MODULO I JOAO ELIAS GUEDES;MUNICIPIO DE BARRA DO PIRAI;BARRA DO PIRAI;2287722;CENTRO DE SAUDE/UNIDADE BASICA
POSTO DE SAUDE ALBERT SABIN;MUNICIPIO DE BARRA DO PIRAI;BARRA DO PIRAI;2287757;CENTRO DE IMUNIZACAO
ESF OFICINAS VELHAS DELCY PEDRO LOURENCO;MUNICIPIO DE BARRA DO PIRAI;BARRA DO PIRAI;2287846;CENTRO DE SAUDE/UNIDADE BASICA
HOSPITAL E MATERNIDADE MARIA DE NAZARE;CENTRO ESPIRITA PAI JOSE CAMBINDA;BARRA DO PIRAI;2287927;HOSPITAL GERAL
SMS CMS MARCOLINO CANDAU AP 10;SMS RIO CMS MARCOLINO CANDAU AP 10;RIO DE JANEIRO;2288346;CENTRO DE SAUDE/UNIDADE BASICA
SMS CMS PINDARO DE CARVALHO RODRIGUES AP 21;SMS RIO CMS PINDARO DE CARVALHO RODRIGUES AP 21;RIO DE JANEIRO;2288370;CENTRO DE SAUDE/UNIDADE BASICA
CENTRO DE SAUDE GRANDE ALEGRIA;SECRETARIA MUNICIPAL DE SAUDE DE RESENDE;RESENDE;2288389;CENTRO DE SAUDE/UNIDADE BASICA
USF ITAPUCA;SECRETARIA MUNICIPAL DE SAUDE DE RESENDE;RESENDE;2288397;CENTRO DE SAUDE/UNIDADE BASICA
USF PARAISO;SECRETARIA MUNICIPAL DE SAUDE DE RESENDE;RESENDE;2288435;CENTRO DE SAUDE/UNIDADE BASICA
USF JARDIM PRIMAVERA;SECRETARIA MUNICIPAL DE SAUDE DE RESENDE;RESENDE;2288664;CENTRO DE SAUDE/UNIDADE BASICA
USF NOVO SURUBI;SECRETARIA MUNICIPAL DE SAUDE DE RESENDE;RESENDE;2288850;CENTRO DE SAUDE/UNIDADE BASICA
USF MARIA VERONICA SILVA SAO FRANCISCO DE ASSIS;SECRETARIA MUNICIPAL DE SAUDE DE BARRA MANSA;BARRA MANSA;2289083;CENTRO DE SAUDE/UNIDADE BASICA
USF ISMAEL ALVES DE SOUZA VISTA ALEGRE;PREFEITURA MUNICIPAL DE BARRA MANSA;BARRA MANSA;2289091;CENTRO DE SAUDE/UNIDADE BASICA
SIRENE III USF NOVE DE ABRIL;SECRETARIA MUNICIPAL DE SAUDE DE BARRA MANSA;BARRA MANSA;2289113;CENTRO DE SAUDE/UNIDADE BASICA
USF REDENTOR;SMS BELFORD ROXO;BELFORD ROXO;2289407;CENTRO DE SAUDE/UNIDADE BASICA
USF VILAR NOVO;SMS BELFORD ROXO;BELFORD ROXO;2289482;CENTRO DE SAUDE/UNIDADE BASICA
USF RECANTUS ANTONIO FRANCISCO RIBEIRO;SMS BELFORD ROXO;BELFORD ROXO;2289504;CENTRO DE SAUDE/UNIDADE BASICA
USF PARQUE AMORIM;SMS BELFORD ROXO;BELFORD ROXO;2289660;CENTRO DE SAUDE/UNIDADE BASICA
CENTRO DE ESPECIALIDADE DE JAPUIBA;SMSDC DE CACHOEIRAS DE MACACU;CACHOEIRAS DE MACACU;2289792;CLINICA/CENTRO DE ESPECIALIDADE
ESF MARAPORA;SMSDC DE CACHOEIRAS DE MACACU;CACHOEIRAS DE MACACU;2289806;CENTRO DE SAUDE/UNIDADE BASICA
PSF JOAO NICOLAU GUZZO;PREFEITURA MUNICIPAL DE CANTAGALO;CANTAGALO;2289946;POSTO DE SAUDE
HOSPITAL MUNICIPAL ADAO PEREIRA NUNES;MUNICIPIO DE DUQUE DE CAXIAS;DUQUE DE CAXIAS;2290227;HOSPITAL GERAL
CENTRO PEDIATRICO E NUTRICIONAL;PREFEITURA MUNICIPAL DE SAUDE DE GUAPIMIRIM;GUAPIMIRIM;2290286;CLINICA/CENTRO DE ESPECIALIDADE
UNIDADE DE SAUDE DA FAMILIA VER EUGENIO MARINS COUTINHO;PREFEITURA MUNICIPAL DE ITABORAI;ITABORAI;2290316;CENTRO DE SAUDE/UNIDADE BASICA
UNIDADE DE SAUDE DA FAMILIA RETA NOVA;PREFEITURA MUNICIPAL DE ITABORAI;ITABORAI;2290324;CENTRO DE SAUDE/UNIDADE BASICA
CENTRO DE SAUDE DE ITAOCARA;MUNICIPIO DE ITAOCARA;ITAOCARA;2290413;POLICLINICA
POSTO DE SAUDE NOVO HORIZONTE;NILOPOLIS PREFEITURA;NILOPOLIS;2290634;POSTO DE SAUDE
POSTO MEDICO SANITARIO CABRAL;NILOPOLIS PREFEITURA;NILOPOLIS;2290642;CENTRO DE SAUDE/UNIDADE BASICA
UNIDADE BASICA POSTO CHATUBA;NILOPOLIS PREFEITURA;NILOPOLIS;2290669;CENTRO DE SAUDE/UNIDADE BASICA
POSTO MEDICO SANITARIO NOVA CIDADE;NILOPOLIS PREFEITURA;NILOPOLIS;2290820;CENTRO DE SAUDE/UNIDADE BASICA
UBS WERNECK UNIDADE PEDRO ALVES DE SOUZA;SECRETARIA MUNICIPAL DE SAUDE DE PARAIBA DO SUL;PARAIBA DO SUL;2290979;CENTRO DE SAUDE/UNIDADE BASICA
CENTRO DE SAUDE DR DERLY HELLENA;SECRETARIA MUNICIPAL DE SAUDE DE PARATY;PARATY;2290987;CLINICA/CENTRO DE ESPECIALIDADE
SMS CMS JOSE MESSIAS DO CARMO AP 10;SMS RIO CMS JOSE MESSIAS DO CARMO AP 10;RIO DE JANEIRO;2291274;CENTRO DE SAUDE/UNIDADE BASICA
UBS BUENA;MUNICIPIO DE SAO FRANCISCO DE ITABAPOANA;SAO FRANCISCO DE ITABAPOANA;2291363;CENTRO DE SAUDE/UNIDADE BASICA
UBS EDMARA SOUZA DA SILVA;MUNICIPIO DE SAO FRANCISCO DE ITABAPOANA;SAO FRANCISCO DE ITABAPOANA;2291452;CENTRO DE SAUDE/UNIDADE BASICA
UBS FLORESTA;MUNICIPIO DE SAO FRANCISCO DE ITABAPOANA;SAO FRANCISCO DE ITABAPOANA;2291460;CENTRO DE SAUDE/UNIDADE BASICA
UBS RAPHAEL NOLASCO MOREIRA;MUNICIPIO DE SAO FRANCISCO DE ITABAPOANA;SAO FRANCISCO DE ITABAPOANA;2291487;CENTRO DE SAUDE/UNIDADE BASICA
POLO SANITARIO DR WASHINGTON LUIZ LOPES;SECRETARIA MUNICIPAL DE SAUDE DE SAO GONCALO;SAO GONCALO;2291533;CENTRO DE SAUDE/UNIDADE BASICA
USF LUIZ CARLOS PRESTES;SECRETARIA MUNICIPAL DE SAUDE DE SAO GONCALO;SAO GONCALO;2291703;CENTRO DE SAUDE/UNIDADE BASICA
POLICLINICA DO COELHO DOUTOR AECIO NANCI;SECRETARIA MUNICIPAL DE SAUDE DE SAO GONCALO;SAO GONCALO;2291746;POLICLINICA
CLINICA MUNICIPAL GONCALENSE UNIDADE BARRO VERMELHO;SECRETARIA MUNICIPAL DE SAUDE DE SAO GONCALO;SAO GONCALO;2291789;POLICLINICA
USF BARBOSA LIMA SOBRINHO;SECRETARIA MUNICIPAL DE SAUDE DE SAO GONCALO;SAO GONCALO;2291894;CENTRO DE SAUDE/UNIDADE BASICA
ESTRATEGIA DA SAUDE DA FAMILIA ESF ANTONIO MORAES FILHO;SECRETARIA MUNICIPAL DE SAUDE DE SAO JOSE DE UBA;SAO JOSE DE UBA;2292238;CENTRO DE SAUDE/UNIDADE BASICA
HOSPITAL MATERNIDADE SANTA THERESINHA;SECRETARIA MUNICIPAL DE SAUDE DE SAO JOSE DO VALE DO RIO PRE;SAO JOSE DO VALE DO RIO PRETO;2292270;HOSPITAL GERAL
CENTRO DE VIGILANCIA EM SAUDE;SMS SUMIDOURO;SUMIDOURO;2292378;UNIDADE DE VIGILANCIA EM SAUDE
UNIDADE BASICA DE SAUDE DA FAMILIA DE FONTE SANTA;SECRETARIA MUNICIPAL DE SAUDE;TERESOPOLIS;2292408;CENTRO DE SAUDE/UNIDADE BASICA
CENTRO MUNICIPAL DE SAUDE DR ARMANDO GOMES SA COUTO;SECRETARIA MUNICIPAL DE SAUDE;TERESOPOLIS;2292424;CLINICA/CENTRO DE ESPECIALIDADE
UNIDADE BASICA DE SAUDE DA FAMILIA DE GRANJA GUARANI;SECRETARIA MUNICIPAL DE SAUDE;TERESOPOLIS;2292467;CENTRO DE SAUDE/UNIDADE BASICA
UNIDADE BASICA DE SAUDE DA FAMILIA DE ROSARIO;SECRETARIA MUNICIPAL DE SAUDE;TERESOPOLIS;2292475;CENTRO DE SAUDE/UNIDADE BASICA
UBS BEMPOSTA;FUNDO MUNICIPAL DE SAUDE DE TRES RIOS;TRES RIOS;2292548;CENTRO DE SAUDE/UNIDADE BASICA
UBS PONTO AZUL;FUNDO MUNICIPAL DE SAUDE DE TRES RIOS;TRES RIOS;2292556;CENTRO DE SAUDE/UNIDADE BASICA
UBS MORADA DO SOL;FUNDO MUNICIPAL DE SAUDE DE TRES RIOS;TRES RIOS;2292572;CENTRO DE SAUDE/UNIDADE BASICA
UBS WERNECK MARINE;FUNDO MUNICIPAL DE SAUDE DE TRES RIOS;TRES RIOS;2292610;CENTRO DE SAUDE/UNIDADE BASICA
ESF OSORIO;MUNICIPIO DE VALENCA;VALENCA;2292831;CENTRO DE SAUDE/UNIDADE BASICA
ESF CONSERVATORIA;MUNICIPIO DE VALENCA;VALENCA;2292874;CENTRO DE SAUDE/UNIDADE BASICA
HOSPITAL ESCOLA LUIZ GIOSEFFI JANNUZZI;FUNDACAO EDUCACIONAL D ANDRE ARCOVERDE;VALENCA;2292912;HOSPITAL GERAL
ESF PARQUE PENTAGNA;MUNICIPIO DE VALENCA;VALENCA;2293048;CENTRO DE SAUDE/UNIDADE BASICA
CENTRO DE ESPECIALIDADES RODOLFO ESTACIO GAMBETA;SECRETARIA MUNICIPAL DE SAUDE DE CONCEICAO DE MACABU;CONCEICAO DE MACABU;2293463;POSTO DE SAUDE
PSF CENTRO;MUNICIPIO DE CORDEIRO;CORDEIRO;2293528;CENTRO DE SAUDE/UNIDADE BASICA
PSF LAVRINHAS;MUNICIPIO DE CORDEIRO;CORDEIRO;2293552;CENTRO DE SAUDE/UNIDADE BASICA
CENTRO POLICLINICO BAIRRO DE FATIMA;SECRETARIA MUNICIPAL DE SAUDE DE PORTO REAL;PORTO REAL;2293641;POLICLINICA
POLICLINICA WALTER GOMES FRANCKLIN;FUNDO MUNICIPAL DE SAUDE DE TRES RIOS;TRES RIOS;2293749;POLICLINICA
UBS MONTE CASTELO;PREFEITURA MUNICIPAL DE TRES RIOS;TRES RIOS;2293757;CENTRO DE SAUDE/UNIDADE BASICA
SUB POSTO PAIOL;NILOPOLIS PREFEITURA;NILOPOLIS;2293870;POSTO DE SAUDE
UNIDADE BASICA DE SAUDE VILA RICA;PREFEITURA MUNICIPAL DE ITABORAI;ITABORAI;2294141;CENTRO DE SAUDE/UNIDADE BASICA
UNIDADE DE SAUDE DA FAMILIA MARIA DO ROSARIO OLIVEIRA;PREFEITURA MUNICIPAL DE ITABORAI;ITABORAI;2294176;CENTRO DE SAUDE/UNIDADE BASICA
UNIDADE DE SAUDE DA FAMILIA DE GOVERNADOR PORTELA;SECRETARIA MUNICIPAL DE SAUDE DE MIGUEL PEREIRA;MIGUEL PEREIRA;2294257;CENTRO DE SAUDE/UNIDADE BASICA
UNIDADE SAUDE DA FAMILIA DO CRUZEIRO;MUNICIPIO DE PINHEIRAL;PINHEIRAL;2294508;CENTRO DE SAUDE/UNIDADE BASICA
UNIDADE SAUDE DA FAMILIA BELA VISTA;MUNICIPIO DE PINHEIRAL;PINHEIRAL;2294516;CENTRO DE SAUDE/UNIDADE BASICA
UNIDADE SAUDE DA FAMILIA IPE;MUNICIPIO DE PINHEIRAL;PINHEIRAL;2294524;CENTRO DE SAUDE/UNIDADE BASICA
ESF CENTRO CIMARLEI LEITE DA CRUZ;SECRETARIA MUNICIPAL DE SAUDE E PROMOCAO SOCIAL;SAO FIDELIS;2294648;CENTRO DE SAUDE/UNIDADE BASICA
UBS CAMBIASCA;SECRETARIA MUNICIPAL DE SAUDE E PROMOCAO SOCIAL;SAO FIDELIS;2294672;POSTO DE SAUDE
ESF BOA ESPERANCA;SECRETARIA MUNICIPAL DE SAUDE E PROMOCAO SOCIAL;SAO FIDELIS;2294710;POSTO DE SAUDE
ESF VILA DOS COROADOS AUGUSTO JOSE DE ANDRADE;SECRETARIA MUNICIPAL DE SAUDE E PROMOCAO SOCIAL;SAO FIDELIS;2294753;CENTRO DE SAUDE/UNIDADE BASICA
UNIDADE DE SAUDE DA FAMILIA BANDEIRANTES II;SECRETARIA MUNICIPAL DE SAUDE DE TANGUA;TANGUA;2294885;CENTRO DE SAUDE/UNIDADE BASICA
SMS CMS MARIA CRISTINA ROMA PAUGARTTEN AP 31;SMS RIO CMS MARIA CRISTINA ROMA PAUGARTTEN AP 31;RIO DE JANEIRO;2295032;CENTRO DE SAUDE/UNIDADE BASICA
SMS CF JOAO BATISTA CHAGAS AP 53;SMS RIO CF DR JOAO BATISTA CHAGAS AP53;RIO DE JANEIRO;2295237;CENTRO DE SAUDE/UNIDADE BASICA
SMS CF WALDEMAR BERARDINELLI AP 53;SMS RIO CF PROF WALDEMAR BERARDINELLI AP 53;RIO DE JANEIRO;2295253;CENTRO DE SAUDE/UNIDADE BASICA
SMS HOSPITAL MUNICIPAL ROCHA FARIA AP 52;SMS RIO HOSPITAL MUNICIPAL ROCHA FARIA AP 52;RIO DE JANEIRO;2295407;HOSPITAL GERAL
UNIDADE SAUDE FAMILIA MARIA DA GL L P PTE DAS LARANJEIRAS;SECRETARIA MUNICIPAL DE SAUDE DE PIRAI;PIRAI;2295571;CENTRO DE SAUDE/UNIDADE BASICA
MSC LAGES I;MUNICIPIO DE PARACAMBI;PARACAMBI;2295644;CENTRO DE SAUDE/UNIDADE BASICA
UNIDADE DE SAUDE ALBA MONTEIRO BERNARDES;SMS DE PATY DO ALFERES;PATY DO ALFERES;2295695;CLINICA/CENTRO DE ESPECIALIDADE
UNIDADE DE SAUDE DA FAMILIA IMBARIE;MUNICIPIO DE DUQUE DE CAXIAS;DUQUE DE CAXIAS;2295865;CENTRO DE SAUDE/UNIDADE BASICA
UBS IGUABA PEQUENA ENFERMEIRA STELLA VIGNA MACIEL;PREFEITURA MUNICIPAL DE IGUABA GRANDE;IGUABA GRANDE;2295938;CENTRO DE SAUDE/UNIDADE BASICA
UBS NOVA IGUABA SR NARCIANILO P DE MACEDO;PREFEITURA MUNICIPAL DE IGUABA GRANDE;IGUABA GRANDE;2295946;CENTRO DE SAUDE/UNIDADE BASICA
ESF ATAFONA;MUNICIPIO DE SAO JOAO DA BARRA;SAO JOAO DA BARRA;2295989;CENTRO DE SAUDE/UNIDADE BASICA
ESF PALACETE;MUNICIPIO DE SAO JOAO DA BARRA;SAO JOAO DA BARRA;2296012;CENTRO DE SAUDE/UNIDADE BASICA
CLINICA DE SAUDE DA FAMILIA DO ORINDI;PREFEITURA MUNICIPAL DE GUAPIMIRIM;GUAPIMIRIM;2296144;CENTRO DE SAUDE/UNIDADE BASICA
UNIDADE DE SAUDE DA FAMILIA BAIRRO JARDIM DAS ACACIAS;SECRETARIA MUNICIPAL DE SAUDE DE PORTO REAL;PORTO REAL;2296225;CENTRO DE SAUDE/UNIDADE BASICA
UNIDADE DE SAUDE DA FAMILIA JOSE FERREIRA DE SOUZA;PREFEITURA MUNICIPAL DE VASSOURAS;VASSOURAS;2296357;CENTRO DE SAUDE/UNIDADE BASICA
UNIDADE DE SAUDE DA FAMILIA DR NELSON DOS SANTOS GONCALVES;PREFEITURA MUNICIPAL DE VASSOURAS;VASSOURAS;2296365;CENTRO DE SAUDE/UNIDADE BASICA
SMS CMS NAGIB JORGE FARAH AP 31;SMS RIO CMS DR NAGIB JORGE FARAH AP 31;RIO DE JANEIRO;2296535;CENTRO DE SAUDE/UNIDADE BASICA
SMS CMS JORGE SALDANHA BANDEIRA DE MELLO AP 40;SMS RIO CMS JORGE SALDANHA BANDEIRA DE MELLO AP 40;RIO DE JANEIRO;2296543;CENTRO DE SAUDE/UNIDADE BASICA
SMS CMS AMERICO VELOSO AP 31;SMS RIO CMS AMERICO VELOSO AP 31;RIO DE JANEIRO;2296551;CENTRO DE SAUDE/UNIDADE BASICA
SMS CMS NASCIMENTO GURGEL AP 33;SMS RIO CMS DR NASCIMENTO GURGEL AP 33;RIO DE JANEIRO;2296586;CENTRO DE SAUDE/UNIDADE BASICA
UNIDADE DE SAUDE DA FAMILIA DO TAQUARI;SECRETARIA MUNICIPAL DE SAUDE DE PARATY;PARATY;2296683;CENTRO DE SAUDE/UNIDADE BASICA
UNIDADE BASICA DE SAUDE JULIO BARROS;MUNICIPIO DE QUEIMADOS;QUEIMADOS;2297019;CENTRO DE SAUDE/UNIDADE BASICA
POLO SANITARIO HELIO CRUZ;SECRETARIA MUNICIPAL DE SAUDE DE SAO GONCALO;SAO GONCALO;2297213;CENTRO DE SAUDE/UNIDADE BASICA
POLO SANITARIO RIO DO OURO DR AUGUSTO SENNA;SECRETARIA MUNICIPAL DE SAUDE DE SAO GONCALO;SAO GONCALO;2297256;CENTRO DE SAUDE/UNIDADE BASICA
CENTRO ESPECIALIZADO EM REABILITACAO CER III;SECRETARIA MUNICIPAL DE SAUDE DE SAO GONCALO;SAO GONCALO;2297299;POLICLINICA
MATERNIDADE MUNICIPAL DR MARIO NIAJAR;MUNICIPIO DE SAO GONCALO;SAO GONCALO;2297590;HOSPITAL ESPECIALIZADO
UNIDADE BASICA DE SAUDE DA FAMILIA DE VARGEM GRANDE;SECRETARIA MUNICIPAL DE SAUDE;TERESOPOLIS;2297736;CENTRO DE SAUDE/UNIDADE BASICA
UNIDADE BASICA DE SAUDE DA FAMILIA DE GRANJA FLORESTAL;SECRETARIA MUNICIPAL DE SAUDE;TERESOPOLIS;2297752;CENTRO DE SAUDE/UNIDADE BASICA
HOSPITAL DAS CLINICAS DE TERESOPOLIS;FESO FUNDACAO EDUCACIONAL SERRA DOS ORGAOS;TERESOPOLIS;2297795;HOSPITAL GERAL
PRONTO SOCORRO PARQUE AEROPORTO;MUNICIPIO DE MACAE;MACAE;2297825;POLICLINICA
SMS HOSPITAL MUNICIPAL ALBERT SCHWEITZER AP 51;SMS RIO HOSPITAL MUNICIPAL ALBERT SCHWEITZER AP 51;RIO DE JANEIRO;2298120;HOSPITAL GERAL
USF SANTA LUCIA;SECRETARIA MUNICIPAL DE SAUDE;BARRA MANSA;2298147;CENTRO DE SAUDE/UNIDADE BASICA
HOSPITAL DOS PLANTADORES DE CANA;ASSOCIACAO FLUMINENSE DE ASSIST A MULHER CRIANCA E AO IDOSO;CAMPOS DOS GOYTACAZES;2298317;HOSPITAL GERAL
UNIDADE DE SAUDE DA FAMILIA VILA SERRANA I;MUNICIPIO DE MAGE;MAGE;2298465;CENTRO DE SAUDE/UNIDADE BASICA
USF DO YPIRANGA DR MAURICIO TOCCI LOURES;MUNICIPIO DE MAGE;MAGE;2298473;CENTRO DE SAUDE/UNIDADE BASICA
UNIDADE SAUDE DE FAMILIA DO PARTIDO;MUNICIPIO DE MAGE;MAGE;2298481;CENTRO DE SAUDE/UNIDADE BASICA
